question,answer
Mật khẩu WiFi hoặc Wi-Fi tại Highlands Coffee là gì?,Mật khẩu WiFi dành cho khách tại cửa hàng Highlands Coffee là Highland123. Nếu không kết nối được hãy hỏi nhân viên cửa hàng vì một số chi nhánh có thể dùng mật khẩu khác.
Wifi password Highlands Coffee,The guest WiFi password at Highlands Coffee stores is Highland123. Ask staff if it does not work at your location.
Cửa hàng Highlands mở cửa lúc mấy giờ?,Đa số cửa hàng Highlands Coffee mở khoảng 7:00–22:00; giờ cụ thể có thể khác theo từng địa điểm — vui lòng xem Google Maps hoặc hỏi cửa hàng.
Highlands có giao hàng không?,Highlands Coffee thường hợp tác với các ứng dụng giao đồ ăn (ví dụ GrabFood) tùy khu vực; kiểm tra trên app tại địa chỉ của bạn.
Có bán trà sữa không?,Thực đơn Highlands tập trung cà phê và trà; trà sữa có thể có hoặc không tùy món theo mùa — xem menu tại quầy hoặc app đặt hàng.
Món nào bán chạy?,Phin Sữa Đá và các dòng Phin/Trà là nhóm món phổ biến; món bán chạy nhất từng cửa hàng có thể khác nhau.
Có chỗ ngồi ngoài trời không?,Nhiều cửa hàng có khu ngồi ngoài trời nhưng không phải chi nhánh nào cũng có — hỏi nhân viên tại quầy.
Thanh toán thẻ hoặc ví được không?,Highlands Coffee thường chấp nhận thẻ và ví điện tử phổ biến tại Việt Nam; cửa hàng nhỏ có thể chỉ nhận tiền mặt — xem biển báo tại quầy.
